*** PACKET N° 0
Ether / IP / TCP 192.168.1.23:60378 > 140.82.113.26:https A
*** PACKET N° 1
Ether / IP / TCP 140.82.113.26:https > 192.168.1.23:60378 A
*** PACKET N° 2
Ether / IP / TCP 140.82.113.26:https > 192.168.1.23:60378 PA / Raw
*** PACKET N° 3
Ether / IP / TCP 192.168.1.23:60378 > 140.82.113.26:https PA / Raw
*** PACKET N° 4
Ether / IP / TCP 140.82.113.26:https > 192.168.1.23:60378 A
*** PACKET N° 5
Ether / IP / TCP 192.168.1.23:60864 > 52.168.112.67:https A
*** PACKET N° 6
Ether / IP / TCP 52.168.112.67:https > 192.168.1.23:60864 A / Padding
*** PACKET N° 7
Ether / IP / TCP 192.168.1.23:36126 > 140.82.121.5:https A
*** PACKET N° 8
Ether / IP / TCP 140.82.121.5:https > 192.168.1.23:36126 A
*** PACKET N° 9
Ether / IP / TCP 140.82.113.26:https > 192.168.1.23:40010 PA / Raw
*** PACKET N° 10
Ether / IP / TCP 192.168.1.23:40010 > 140.82.113.26:https PA / Raw
*** PACKET N° 11
Ether / IP / TCP 140.82.113.26:https > 192.168.1.23:40010 A
